{"$schema":"https://json-schema.org/draft/2020-12/schema","$id":"https://universalos.dev/specs/device-enablement/manifest-v1.json","title":"UniversalOS device enablement manifest v1","type":"object","additionalProperties":false,"required":["schema_version","enablement_id","profile_id","bootstrap_capsule","support_tier","recovery","features","provenance_components"],"properties":{"schema_version":{"const":1},"enablement_id":{"type":"string","pattern":"^uos\\.enablement\\.[a-z0-9][a-z0-9._-]*$"},"profile_id":{"type":"string"},"bootstrap_capsule":{"type":"object","additionalProperties":false,"required":["id","version"],"properties":{"id":{"type":"string"},"version":{"type":"string"}}},"support_tier":{"enum":["profiled","lab","verified","maintained","retired"]},"recovery":{"type":"object","additionalProperties":false,"required":["offline_path","tested"],"properties":{"offline_path":{"type":"boolean"},"tested":{"type":"boolean"}}},"features":{"type":"object","additionalProperties":{"enum":["working","partial","unavailable","untested","blocked","unsafe"]}},"provenance_components":{"type":"array","minItems":1,"uniqueItems":true,"items":{"type":"string"}}}}
