{"schema_version":1,"enablement_id":"uos.enablement.synthetic.orion-lab-v1","profile_id":"uos.profile.synthetic.orion-arm64-v1","bootstrap_capsule":{"id":"uos.bootstrap.synthetic-orion","version":"0.1.0"},"support_tier":"lab","recovery":{"offline_path":true,"tested":false},"features":{"boot":"working","recovery":"untested","display":"working","input":"working","wifi":"untested"},"provenance_components":["uos.source.universal-contracts","uos.firmware.example-user-extraction"]}
